{
  "schema_version": "1.2",
  "story_id": "story_demo",
  "package_id": "pkg_demo",
  "content_hash": "sha256:1111111111111111111111111111111111111111111111111111111111111111",
  "language": "ru",
  "purpose": "product",
  "audience": "руководители продуктовых направлений",
  "goal": "получить одобрение на пилот",
  "effective_brief": {
    "purpose": "product",
    "title": "Запуск сервиса умных уведомлений",
    "audience": "руководители продуктовых направлений",
    "goal": "получить одобрение на пилот",
    "language": "ru",
    "must_include": [
      "метрики пилота",
      "план на квартал"
    ],
    "avoid": [
      "технические детали инфраструктуры"
    ],
    "slide_count": {
      "min": 10,
      "max": 15
    }
  },
  "key_takeaway": "Умные уведомления возвращают 40 % потерянного внимания пользователей",
  "theses": [
    {
      "thesis_id": "t1",
      "order": 1,
      "kind": "section",
      "statement": "Проблема",
      "required": true
    },
    {
      "thesis_id": "t2",
      "order": 2,
      "kind": "claim",
      "parent_id": "t1",
      "statement": "Пользователи теряют {fact:f1} важных уведомлений без приоритизации",
      "required": true,
      "source_refs": [
        "b2"
      ],
      "fact_refs": [
        "f1"
      ],
      "suggested_visual": "number"
    },
    {
      "thesis_id": "t3",
      "order": 3,
      "kind": "section",
      "statement": "Решение",
      "required": true
    },
    {
      "thesis_id": "t4",
      "order": 4,
      "kind": "claim",
      "parent_id": "t3",
      "statement": "Три механизма: приоритизация по контексту, единый центр, тихие часы",
      "required": true,
      "source_refs": [
        "b3"
      ],
      "suggested_visual": "bullets"
    },
    {
      "thesis_id": "t5",
      "order": 5,
      "kind": "evidence",
      "parent_id": "t3",
      "statement": "Открываемость выросла с {fact:f4} до {fact:f5} за три месяца пилота",
      "required": true,
      "fact_refs": [
        "f4",
        "f5",
        "f3"
      ],
      "dataset_refs": [
        "ds_metrics"
      ],
      "suggested_visual": "chart"
    },
    {
      "thesis_id": "t6",
      "order": 6,
      "kind": "conclusion",
      "statement": "Пилот окупается: экономия {fact:f2} в год",
      "required": true,
      "fact_refs": [
        "f2"
      ],
      "suggested_visual": "number"
    },
    {
      "thesis_id": "t7",
      "order": 7,
      "kind": "call_to_action",
      "statement": "Просим одобрить расширение пилота на все продукты в четвёртом квартале",
      "required": true
    }
  ],
  "allowed_reductions": [
    {
      "thesis_id": "t5",
      "reduction": "chart_to_number",
      "note": "в компактном варианте достаточно итогового роста"
    }
  ],
  "assumptions": [
    "бюджет пилота в материалах отсутствует, слайд с планом не содержит сумм"
  ],
  "coverage": {
    "must_keep_facts": {
      "total": 2,
      "covered": 2
    },
    "must_include": [
      {
        "item": "метрики пилота",
        "thesis_ids": [
          "t5"
        ]
      },
      {
        "item": "план на квартал",
        "thesis_ids": [
          "t7"
        ]
      }
    ]
  },
  "generation_meta": {
    "skills": [
      {
        "name": "story_planner",
        "version": "0.2.0"
      }
    ],
    "prompts": [
      {
        "name": "story.outline",
        "version": "0.2.0"
      }
    ],
    "models": [
      {
        "role": "llm",
        "name": "qwen3.8-27b",
        "provider": "qwen-api",
        "hf_url": "https://huggingface.co/Qwen/Qwen3.8-27B",
        "params_b": 27,
        "license": "Apache-2.0",
        "reasoning_mode": "off"
      }
    ],
    "seed": 42,
    "temperature": 0.2,
    "prompt_tokens": 4100,
    "completion_tokens": 1200,
    "cache_hit": false,
    "created_at": "2026-09-15T12:00:00Z"
  },
  "warnings": []
}
